{
  "$schema": "https://json-schema.org/draft/2020-12/schema",
  "$id": "https://er-commons.local/schemas/response_inventory/v5/reference_run_spec.schema.json",
  "title": "ER Commons Task 05F qualified exact Draft EIR reference run specification",
  "type": "object",
  "additionalProperties": false,
  "required": [
    "schema_version", "task_stage", "scope_kind", "accepted_task05d",
    "accepted_task05e", "task04", "repository_bindings",
    "producer_code_sha256", "output_policy", "stop_behavior"
  ],
  "properties": {
    "schema_version": {"const": "er_commons.response_reference_run_spec.v5"},
    "task_stage": {"const": "05f"},
    "scope_kind": {"const": "qualified_exact_draft_eir_reference_rules"},
    "accepted_task05d": {"$ref": "#/$defs/accepted_task05d"},
    "accepted_task05e": {"$ref": "#/$defs/accepted_task05e"},
    "task04": {"$ref": "#/$defs/task04"},
    "repository_bindings": {
      "type": "array", "minItems": 5, "maxItems": 5,
      "items": {"$ref": "#/$defs/repository_binding"}
    },
    "producer_code_sha256": {"$ref": "#/$defs/sha256"},
    "output_policy": {
      "type": "object", "additionalProperties": false,
      "required": ["artifact_relative_root", "candidate_namespace_template", "completion_written", "copy_source_payload", "copy_upstream_payloads"],
      "properties": {
        "artifact_relative_root": {"$ref": "#/$defs/relative_path"},
        "candidate_namespace_template": {"const": "working/05f/rulesv1-{activity_hash}"},
        "completion_written": {"const": false},
        "copy_source_payload": {"const": false},
        "copy_upstream_payloads": {"const": false}
      }
    },
    "stop_behavior": {
      "type": "object", "additionalProperties": false,
      "required": [
        "on_input_binding_mismatch", "on_invalid_record_or_schema", "on_population_mismatch",
        "exact_first", "leading_identifier_fallback", "attached_title_fallback",
        "structured_appendix_designator_normalization", "unique_outer_appendix_document",
        "reject_more_specific_appendix_downgrade", "block_known_f1_source_identity_failure",
        "source_filter_before_cardinality",
        "deduplicate_target_ids_before_cardinality", "fuzzy_or_semantic_matching",
        "source_pdf_access", "hash_large_upstream_payloads", "allow_policy_repair_during_run"
      ],
      "properties": {
        "on_input_binding_mismatch": {"const": "stop"},
        "on_invalid_record_or_schema": {"const": "stop"},
        "on_population_mismatch": {"const": "stop"},
        "exact_first": {"const": true},
        "leading_identifier_fallback": {"const": true},
        "attached_title_fallback": {"const": true},
        "structured_appendix_designator_normalization": {"const": true},
        "unique_outer_appendix_document": {"const": true},
        "reject_more_specific_appendix_downgrade": {"const": true},
        "block_known_f1_source_identity_failure": {"const": true},
        "source_filter_before_cardinality": {"const": true},
        "deduplicate_target_ids_before_cardinality": {"const": true},
        "fuzzy_or_semantic_matching": {"const": false},
        "source_pdf_access": {"const": false},
        "hash_large_upstream_payloads": {"const": false},
        "allow_policy_repair_during_run": {"const": false}
      }
    }
  },
  "$defs": {
    "sha256": {"type": "string", "pattern": "^[0-9a-f]{64}$"},
    "relative_path": {"type": "string", "minLength": 1, "not": {"pattern": "(^/|(^|/)\\.\\.(/|$))"}},
    "accepted_task05d": {
      "type": "object", "additionalProperties": false,
      "required": ["candidate_root", "acceptance_path", "revision_id", "acceptance_id", "activity_id", "completion_id", "inventory_id", "semantic_digest"],
      "properties": {
        "candidate_root": {"$ref": "#/$defs/relative_path"}, "acceptance_path": {"$ref": "#/$defs/relative_path"},
        "revision_id": {"type": "string", "pattern": "^revisionv1-[0-9a-f]{64}$"},
        "acceptance_id": {"type": "string", "pattern": "^acceptancev1-[0-9a-f]{64}$"},
        "activity_id": {"type": "string", "pattern": "^activityv1-[0-9a-f]{64}$"},
        "completion_id": {"type": "string", "pattern": "^completionv1-[0-9a-f]{64}$"},
        "inventory_id": {"type": "string", "pattern": "^fileinventoryv1-[0-9a-f]{64}$"},
        "semantic_digest": {"type": "string", "pattern": "^[0-9a-f]{64}$"}
      }
    },
    "accepted_task05e": {
      "type": "object", "additionalProperties": false,
      "required": ["candidate_root", "acceptance_path", "revision_id", "acceptance_id", "activity_id", "completion_id", "inventory_id", "semantic_digest"],
      "properties": {
        "candidate_root": {"$ref": "#/$defs/relative_path"}, "acceptance_path": {"$ref": "#/$defs/relative_path"},
        "revision_id": {"type": "string", "pattern": "^revisionv1-[0-9a-f]{64}$"},
        "acceptance_id": {"type": "string", "pattern": "^acceptancev1-[0-9a-f]{64}$"},
        "activity_id": {"type": "string", "pattern": "^activityv1-[0-9a-f]{64}$"},
        "completion_id": {"type": "string", "pattern": "^completionv1-[0-9a-f]{64}$"},
        "inventory_id": {"type": "string", "pattern": "^fileinventoryv1-[0-9a-f]{64}$"},
        "semantic_digest": {"type": "string", "pattern": "^[0-9a-f]{64}$"}
      }
    },
    "task04": {
      "type": "object", "additionalProperties": false,
      "required": [
        "task04a_gate_d_root", "task04a_review_id", "gate_d_completion_sha256",
        "usability_registry_sha256", "ambiguous_dispositions_sha256", "unresolved_risk_sha256",
        "task04d_handoff_root", "task04d_handoff_id", "handoff_completion_sha256",
        "production_extraction_id", "scope_id", "target_index_root", "target_index_id",
        "target_index_completion_sha256", "source_family_catalog_path", "source_family_catalog_sha256"
      ],
      "properties": {
        "task04a_gate_d_root": {"$ref": "#/$defs/relative_path"}, "task04a_review_id": {"const": "reviewv1-task03j-final-c17"},
        "gate_d_completion_sha256": {"const": "d480aa903d7ae65e7a4b1b6de93ad4cdebe6963e6fd724873ade548790712826"},
        "usability_registry_sha256": {"const": "0453aaf13cb7762e7718ce869ee3f1521a67625224bd35c83b641cc5ae8d47e1"},
        "ambiguous_dispositions_sha256": {"const": "9d3b8ac7c9fea34ecada607c99b96376d648c2ab419bfa381abbf30f4b2e3366"},
        "unresolved_risk_sha256": {"const": "b6ac41902ffdfc6c93b13c0be93af5d071f3811334a27367fc2ccdacf2f7a5ca"},
        "task04d_handoff_root": {"$ref": "#/$defs/relative_path"},
        "task04d_handoff_id": {"const": "handoffv1-e54a72e4bb8f9ba34888c1fc1f51424c4cc52e5f24d6700b16b462e3a659b6d1"},
        "handoff_completion_sha256": {"const": "387a07d62d96e4c5aba6f1f3d51f7f9026719b0d7de1b4eece06bed9fd78bc81"},
        "production_extraction_id": {"const": "exv1-466e4e9aced080621fa81058acca95a4e37f1d9a63f2362a569bd9205830b5a3"},
        "scope_id": {"const": "scopev1-044b983a5cbafe3852b2ce90ee82ccdd712fc76698ffcc455ad56caaab5b04da"},
        "target_index_root": {"$ref": "#/$defs/relative_path"},
        "target_index_id": {"const": "idxv1-31a3eacee1d03001d44f79d2fa15563cfd416b9a80c02e8d178d0843e4bb4a00"},
        "target_index_completion_sha256": {"const": "a661cfefed67927b7536fe791eb6f6dcfe705dc044e4e4dc9867977790cdfa31"},
        "source_family_catalog_path": {"$ref": "#/$defs/relative_path"},
        "source_family_catalog_sha256": {"$ref": "#/$defs/sha256"}
      }
    },
    "repository_binding": {
      "type": "object", "additionalProperties": false,
      "required": ["role", "authority", "path", "sha256"],
      "properties": {
        "role": {"enum": ["response_record_schema", "producer_run_spec_code", "reference_run_spec_schema", "reference_outcome_schema", "task04d_collection_spec"]},
        "authority": {"const": "repository"}, "path": {"$ref": "#/$defs/relative_path"}, "sha256": {"$ref": "#/$defs/sha256"}
      }
    }
  }
}
