{
  "schema_version": "er_commons.response_reference_run_spec.v5",
  "task_stage": "05f",
  "scope_kind": "qualified_exact_draft_eir_reference_rules",
  "accepted_task05d": {
    "candidate_root": "pipelines/brisbane_baylands/task_05_response_inventory/working/05d/revisionv1-857ecbc97cccc24bf18808acffd9d36418f850423b6487cafb78bbaebe26e030",
    "acceptance_path": "pipelines/brisbane_baylands/task_05_response_inventory/working/05d/revisionv1-857ecbc97cccc24bf18808acffd9d36418f850423b6487cafb78bbaebe26e030.acceptance.json",
    "revision_id": "revisionv1-857ecbc97cccc24bf18808acffd9d36418f850423b6487cafb78bbaebe26e030",
    "acceptance_id": "acceptancev1-7edf64ffd5e283c736e9980c79f682997ce06c135038d4ceb3ecbc496ce6c027",
    "activity_id": "activityv1-857ecbc97cccc24bf18808acffd9d36418f850423b6487cafb78bbaebe26e030",
    "completion_id": "completionv1-82d534e4e3cc7db7275892690fe4d357540131c9477775d5ebf1d54ad6ab555f",
    "inventory_id": "fileinventoryv1-a04c715a6dff6bdfe6d28eaed9b40211382d60a74d540cdf46cd3b2c993c60a0",
    "semantic_digest": "f7aa9fd6e6d4e464b27b270e6f61a8dcbfb0d998dc44e7eda84abd07db5d9247"
  },
  "accepted_task05e": {
    "candidate_root": "pipelines/brisbane_baylands/task_05_response_inventory/working/05e/revisionv1-df6e04a7f24a79ad15dbb12f0796edcd9c9348bdd1f1db94093dd800e4091ca1",
    "acceptance_path": "pipelines/brisbane_baylands/task_05_response_inventory/working/05e/revisionv1-df6e04a7f24a79ad15dbb12f0796edcd9c9348bdd1f1db94093dd800e4091ca1.acceptance.json",
    "revision_id": "revisionv1-df6e04a7f24a79ad15dbb12f0796edcd9c9348bdd1f1db94093dd800e4091ca1",
    "acceptance_id": "acceptancev1-4b8a13393c57660fdb0a6b303912150ca9d1380688a86a6728267a4c79aacac5",
    "activity_id": "activityv1-df6e04a7f24a79ad15dbb12f0796edcd9c9348bdd1f1db94093dd800e4091ca1",
    "completion_id": "completionv1-867b3e6f9d9cc1e2666cb184523590c2fd02154347ea9787144e61bb43851555",
    "inventory_id": "fileinventoryv1-924533bd3c59160bd0853aa38dc095965b07b2d4bf2d78a5ad9431cd2836f667",
    "semantic_digest": "3a6f5b0f4f116b2800e0a8b02bb98fde9d37a48ccc0baff321fd484f2489e71b"
  },
  "task04": {
    "task04a_gate_d_root": "pipelines/brisbane_baylands/task_04_review/reviewv1-task03j-final-c17/gate_d",
    "task04a_review_id": "reviewv1-task03j-final-c17",
    "gate_d_completion_sha256": "d480aa903d7ae65e7a4b1b6de93ad4cdebe6963e6fd724873ade548790712826",
    "usability_registry_sha256": "0453aaf13cb7762e7718ce869ee3f1521a67625224bd35c83b641cc5ae8d47e1",
    "ambiguous_dispositions_sha256": "9d3b8ac7c9fea34ecada607c99b96376d648c2ab419bfa381abbf30f4b2e3366",
    "unresolved_risk_sha256": "b6ac41902ffdfc6c93b13c0be93af5d071f3811334a27367fc2ccdacf2f7a5ca",
    "task04d_handoff_root": "pipelines/brisbane_baylands/task_04d_relinked_v1/document_publications/scopes/scopev1-044b983a5cbafe3852b2ce90ee82ccdd712fc76698ffcc455ad56caaab5b04da/handoffs/handoffv1-e54a72e4bb8f9ba34888c1fc1f51424c4cc52e5f24d6700b16b462e3a659b6d1",
    "task04d_handoff_id": "handoffv1-e54a72e4bb8f9ba34888c1fc1f51424c4cc52e5f24d6700b16b462e3a659b6d1",
    "handoff_completion_sha256": "387a07d62d96e4c5aba6f1f3d51f7f9026719b0d7de1b4eece06bed9fd78bc81",
    "production_extraction_id": "exv1-466e4e9aced080621fa81058acca95a4e37f1d9a63f2362a569bd9205830b5a3",
    "scope_id": "scopev1-044b983a5cbafe3852b2ce90ee82ccdd712fc76698ffcc455ad56caaab5b04da",
    "target_index_root": "pipelines/brisbane_baylands/task_04d_relinked_v1/document_publications/scopes/scopev1-044b983a5cbafe3852b2ce90ee82ccdd712fc76698ffcc455ad56caaab5b04da/target_indexes/idxv1-31a3eacee1d03001d44f79d2fa15563cfd416b9a80c02e8d178d0843e4bb4a00",
    "target_index_id": "idxv1-31a3eacee1d03001d44f79d2fa15563cfd416b9a80c02e8d178d0843e4bb4a00",
    "target_index_completion_sha256": "a661cfefed67927b7536fe791eb6f6dcfe705dc044e4e4dc9867977790cdfa31",
    "source_family_catalog_path": "pipelines/brisbane_baylands/task_03h_clean_full_v4/inputs/brisbane_baylands_2025_deir_task03h_v4_source_family_catalog_v1.json",
    "source_family_catalog_sha256": "ad20c9abcb0d1b45c9bb7de5925f026c5e4c209c98da632bc7b3fc52c3006b9c"
  },
  "repository_bindings": [
    {
      "role": "producer_run_spec_code", "authority": "repository",
      "path": "src/er_commons/response_inventory/run_spec.py",
      "sha256": "aebaf8593617edd65b3fe96f884ca7e748a076f1d447552209f923cca945d1ce"
    },
    {
      "role": "reference_outcome_schema", "authority": "repository",
      "path": "benchmarks/er_bench/schemas/response_inventory/v5/reference_outcome.schema.json",
      "sha256": "f2b749b24df1ad7b6da472adb9d87bbfe72404ed878ca48a6204ed03f41f75b7"
    },
    {
      "role": "reference_run_spec_schema", "authority": "repository",
      "path": "benchmarks/er_bench/schemas/response_inventory/v5/reference_run_spec.schema.json",
      "sha256": "64f4a48d5f3728acbe40c810eba62ba96e288783f74e27aff2870a5fd167f41e"
    },
    {
      "role": "response_record_schema", "authority": "repository",
      "path": "benchmarks/er_bench/schemas/response_inventory/v1/records.schema.json",
      "sha256": "fa8cac55243db90b94ac451e9d00dba5d509ef0e07a72a739570dd6994b625ba"
    },
    {
      "role": "task04d_collection_spec", "authority": "repository",
      "path": "configs/brisbane_baylands_2025_deir_task04d_collection_v1.json",
      "sha256": "ef2c3788a582d26b7a395a6ef6435030c4b611f126d8e5f2cc6906f8b81c110d"
    }
  ],
  "producer_code_sha256": "0b49cd50f271015f639a361bb62f2336102684bce5a37a1654e1a98e5e543965",
  "output_policy": {
    "artifact_relative_root": "pipelines/brisbane_baylands/task_05_response_inventory",
    "candidate_namespace_template": "working/05f/rulesv1-{activity_hash}",
    "completion_written": false,
    "copy_source_payload": false,
    "copy_upstream_payloads": false
  },
  "stop_behavior": {
    "on_input_binding_mismatch": "stop",
    "on_invalid_record_or_schema": "stop",
    "on_population_mismatch": "stop",
    "exact_first": true,
    "leading_identifier_fallback": true,
    "attached_title_fallback": true,
    "structured_appendix_designator_normalization": true,
    "unique_outer_appendix_document": true,
    "reject_more_specific_appendix_downgrade": true,
    "block_known_f1_source_identity_failure": true,
    "source_filter_before_cardinality": true,
    "deduplicate_target_ids_before_cardinality": true,
    "fuzzy_or_semantic_matching": false,
    "source_pdf_access": false,
    "hash_large_upstream_payloads": false,
    "allow_policy_repair_during_run": false
  }
}
